{
  "$schema": "./environment.schema.json",
  "name": "test",
  "displayName": "Test",
  "tenantDomain": "disher.sharepoint.com",
  "siteUrl": "https://disher.sharepoint.com/sites/test-intranet",
  "workbenchUrl": "https://disher.sharepoint.com/_layouts/workbench.aspx",
  "apiProxyBaseUrl": "https://api-test.disher.com.au"
}
