{
  "$schema": "./environment.schema.json",
  "name": "dev",
  "displayName": "Development",
  "tenantDomain": "ddredev.sharepoint.com",
  "siteUrl": "https://ddredev.sharepoint.com/sites/intranet",
  "workbenchUrl": "https://ddredev.sharepoint.com/_layouts/workbench.aspx",
  "apiProxyBaseUrl": "https://api-dev.dougdisher.com.au"
}
